utils/test_files/old_gfx90a68.HIP.fdb.txt
1-160-698-5x5-64-79-348-1-1x1-2x2-1x1-0-NCHW-FP32-F=miopenConvolutionFwdAlgoImplicitGEMM:ConvHipImplicitGemmForwardV4R4Xdlops_Padded_Gemm,0.02352,0,miopenConvolutionFwdAlgoImplicitGEMM,not used;miopenConvolutionFwdAlgoWinograd:ConvBinWinogradRxSf2x3g1,0.03856,0,miopenConvolutionFwdAlgoWinograd,not used;miopenConvolutionFwdAlgoDirect:ConvOclDirectFwdGen,0.0536,0,miopenConvolutionFwdAlgoDirect,not used;miopenConvolutionFwdAlgoGEMM:GemmFwdRest,0.05712,2749200,miopenConvolutionFwdAlgoGEMM,not used
1-19-19-1x1-64-19-19-1024-0x0-1x1-1x1-0-NCHW-FP32-B=miopenConvolutionBwdDataAlgoWinograd:ConvBinWinogradRxSf2x3g1,0.186719,0,miopenConvolutionBwdDataAlgoWinograd,not used;miopenConvolutionBwdDataAlgoDirect:ConvOclDirectFwd1x1,0.234239,0,miopenConvolutionBwdDataAlgoDirect,not used;miopenConvolutionBwdDataAlgoGEMM:GemmBwd1x1_stride1,0.239519,0,miopenConvolutionBwdDataAlgoGEMM,not used;miopenConvolutionBwdDataAlgoImplicitGEMM:ConvAsmImplicitGemmGTCDynamicBwdXdlopsNHWC,0.327199,94633984,miopenConvolutionBwdDataAlgoImplicitGEMM,not used
1-19-19-1x1-64-19-19-1024-0x0-1x1-1x1-0-NCHW-FP32-W=miopenConvolutionBwdWeightsAlgoDirect:ConvOclBwdWrW53,0.29008,262144,miopenConvolutionBwdWeightsAlgoDirect,not used;miopenConvolutionBwdWeightsAlgoImplicitGEMM:ConvAsmImplicitGemmGTCDynamicWrwXdlopsNHWC,0.3016,94633984,miopenConvolutionBwdWeightsAlgoImplicitGEMM,not used;miopenConvolutionBwdWeightsAlgoGEMM:GemmWrw1x1_stride1,10.3683,0,miopenConvolutionBwdWeightsAlgoGEMM,not used;miopenConvolutionBwdWeightsAlgoWinograd:ConvBinWinogradRxSf2x3g1,12.5528,0,miopenConvolutionBwdWeightsAlgoWinograd,not used
1-48-480-3x3-16-48-480-1-1x1-1x1-1x1-0-NCHW-FP16-F=miopenConvolutionFwdAlgoImplicitGEMM:ConvHipImplicitGemmForwardV4R4Xdlops_Padded_Gemm,0.02512,0,miopenConvolutionFwdAlgoImplicitGEMM,not used;miopenConvolutionFwdAlgoDirect:ConvOclDirectFwd,0.02544,0,miopenConvolutionFwdAlgoDirect,not used;miopenConvolutionFwdAlgoWinograd:ConvBinWinogradRxSf2x3g1,0.03104,0,miopenConvolutionFwdAlgoWinograd,not used;miopenConvolutionFwdAlgoGEMM:GemmFwdRest,0.06096,414720,miopenConvolutionFwdAlgoGEMM,not used
