utils/test_files/usr_gfx90a68.HIP.fdb.txt
1-160-698-5x5-64-79-348-1-1x1-2x2-1x1-0-NCHW-FP32-F=miopenConvolutionFwdAlgoImplicitGEMM:ConvMlirIgemmFwdXdlops,0.03776,0,miopenConvolutionFwdAlgoImplicitGEMM,not used
1-19-19-1x1-64-19-19-1024-0x0-1x1-1x1-0-NCHW-FP32-B=miopenConvolutionBwdDataAlgoDirect:ConvAsm1x1U,0.09728,0,miopenConvolutionBwdDataAlgoDirect,not used;miopenConvolutionBwdDataAlgoWinograd:ConvBinWinogradRxSf3x2,0.18192,0,miopenConvolutionBwdDataAlgoWinograd,not used;miopenConvolutionBwdDataAlgoImplicitGEMM:ConvMlirIgemmBwdXdlops,0.250079,0,miopenConvolutionBwdDataAlgoImplicitGEMM,not used;miopenConvolutionBwdDataAlgoGEMM:GemmBwd1x1_stride1,2732.22,0,miopenConvolutionBwdDataAlgoGEMM,not used
1-19-19-1x1-64-19-19-1024-0x0-1x1-1x1-0-NCHW-FP32-W=miopenConvolutionBwdWeightsAlgoDirect:ConvAsmBwdWrW1x1,0.445761,0,miopenConvolutionBwdWeightsAlgoDirect,not used;miopenConvolutionBwdWeightsAlgoWinograd:ConvBinWinogradRxSf2x3,11.9268,0,miopenConvolutionBwdWeightsAlgoWinograd,not used;miopenConvolutionBwdWeightsAlgoImplicitGEMM:ConvMlirIgemmWrWXdlops,69.8604,0,miopenConvolutionBwdWeightsAlgoImplicitGEMM,not used
1024-14-14-1x1-256-14-14-15-0x0-1x1-1x1-0-NCHW-FP16-F=miopenConvolutionFwdAlgoImplicitGEMM:ConvHipImplicitGemmForwardV4R4Xdlops_Padded_Gemm,0.03808,0,miopenConvolutionFwdAlgoImplicitGEMM,not used;miopenConvolutionFwdAlgoDirect:ConvAsm1x1U,0.11072,0,miopenConvolutionFwdAlgoDirect,not used;miopenConvolutionFwdAlgoWinograd:ConvBinWinogradRxSf3x2,0.208159,0,miopenConvolutionFwdAlgoWinograd,not used;miopenConvolutionFwdAlgoGEMM:GemmFwd1x1_0_1,2730.97,0,miopenConvolutionFwdAlgoGEMM,not used
